<?xml version="1.0" encoding="WINDOWS-31J"?>
<!DOCTYPE tree PUBLIC "-//F-11 2.0//DTD F11 Tree Configuration//EN" "http://f-11.sourceforge.jp/dtds/tree10.dtd">

<tree initpage="状態一覧表">
	<root name="WifeProject_user2">
		<node name="スケジュール">
			<node name="カレンダー" page="カレンダー"/>
			<node name="スケジュール TABLE" page="スケジュール TABLE"/>
			<node name="スケジュール BAR" page="schedule02"/>
			<node name="スケジュール BAR2" page="schedule01"/>
			<node name="スケジュール BAR3" page="スケジュール BAR3"/>
		</node>
		<node name="グラフ">
			<node name="トレンドグラフ" page="TRND0001"/>
			<node name="日報バーグラフ" page="日報バーグラフ"/>
			<node name="月報バーグラフ" page="月報バーグラフ"/>
		</node>
		<node name="ツリーテスト">
			<node name="ツリー２">
				<node name="ツリー１平面図" page="空調平面図"/>
				<node name="ツリー１状態" page="状態一覧表"/>
				<node name="ツリー１計測" page="計測一覧表"/>
				<node name="積算テスト" page="UNTN0001"/>
			</node>
		</node>
	</root>
</tree>
